name,price,link
Rimmel Stay Matte Pressed Face Powder Warm Honey 010 14 G,"8,28",https://www.ceneo.pl/90375530
Beauty Formulas Stopy Puder do stóp antybakteryjny 100g,"8,32",https://www.ceneo.pl/91834780
"Rimmel Puder Do Brwi 003 Dark Brown 0,7 g","8,39",https://www.ceneo.pl/53863661
Yellow Puder Rozjaśniający Do 7 Tonów 20G,"8,45",https://www.ceneo.pl/96346420
Rimmel London Stay Matte Long Lasting Pressed Powder 14 g Odcień 007 Mohair,"8,59",https://www.ceneo.pl/27205435
Mac Kar Talk kosmetyczny 140 g,"8,64",https://www.ceneo.pl/1318604
Dax Cosmetics Celia De Luxe Velvet Touch 104 Sunny Beige Puder Prasowany  9 G,"8,79",https://www.ceneo.pl/97518985
Lovely Honey Bee Beautiful Honeycomb Highlighting Powder Rozświetlający Puder Do Twarzy 1 9G,"8,89",https://www.ceneo.pl/144006535
Inter Vion Makeup Passion Fan Brush Pędel Do Pudru Wachlarz,"8,89",https://www.ceneo.pl/98108606
Golden Rose EYEBROW POWDER Puder do brwi vit. E 102,"8,90",https://www.ceneo.pl/35587734
Golden Rose EYEBROW POWDER Puder do brwi vit. E 101,"8,90",https://www.ceneo.pl/35587735
FIRMA RODZINNA MAKARCZYKOWIE Zasypka do stóp do codziennej higieny stóp 100g,"8,94",https://www.ceneo.pl/124142610
Revers Egyptian Sun Puder Brązujący 13,"8,99",https://www.ceneo.pl/105053743
"Ecocera BARLEY LOOSE POWDER Sypki puder jęczmienny TESTER 2,5g","8,99",https://www.ceneo.pl/93464215
ALTA proszek przeciw poceniu się stóp 40 g,"8,99",https://www.ceneo.pl/12873431
REVERS Puder Bronze&Shimmer nr 03,"8,99",https://www.ceneo.pl/106843669
Sattva Ayurveda Amla Proszek Wzmacnia Cebulki Włosów Dodaje Włosom Blasku 100 G,"8,99",https://www.ceneo.pl/87839825
Estetica Chlapu Chlap Musujący Puder Do Kąpieli Oranżada 150G,"8,99",https://www.ceneo.pl/84826519
Beaute Marrakech Henna Naturalna W Pudrze 100G,"8,99",https://www.ceneo.pl/60837710
Alpa Pedik Pedik talk do stóp 100 g,"9,00",https://www.ceneo.pl/49735749
Indigo Puder Proszek Akrylowy Cover No.3 4 g,"9,00",https://www.ceneo.pl/124819336
Indigo Puder Proszek Akrylowy Competition White 4 g,"9,00",https://www.ceneo.pl/124819334
Chlapu Chlap Musujący Puder Do Kąpieli Lody Malinowe 150G,"9,00",https://www.ceneo.pl/94449678
Peggy Sage Puszek Do Pudru Sypkiego,"9,03",https://www.ceneo.pl/53595481
Golden Rose EYEBROW POWDER Puder do brwi vit. E 103,"9,14",https://www.ceneo.pl/35587733
Marion Dr Koala Ochronna zasypka do stóp i obuwia 40 g,"9,18",https://www.ceneo.pl/103750440
Fitokosmetik Fitness Model ODNAWIAJĄCY KWASOWY PEELING DO TWARZY ze złotym pudrem 45ml,"9,19",https://www.ceneo.pl/70228902
Medicinae Sp. Z O.O. Heltiso Care Talk Kosmetyczny Bezzapachowy 100 G,"9,20",https://www.ceneo.pl/142492957
HEAN Puder prasowany matujący City Fashion 3 morelowy 13 g,"9,27",https://www.ceneo.pl/31893409
Rimmel London Stay Matte Long Lasting Pressed Powder puder 14 g Odcień 005 Silky Beige,"9,39",https://www.ceneo.pl/22726988
Celia Velvet Touch Puder Brązujący Nr105,"9,42",https://www.ceneo.pl/98108384
Hesh Maseczka w pudrze Neem-Tone 50 g,"9,44",https://www.ceneo.pl/2073918
Yellow Puder Rozjaśniający Do 9 Tonów 50G,"9,45",https://www.ceneo.pl/96346424
Makeup Obsession Game Set Matte Puder do Twarzy Sahara,"9,46",https://www.ceneo.pl/86377165
Rimmel London Stay Matte Long Lasting Pressed Powder puder 14 g Odcień 006 Warm Beige,"9,49",https://www.ceneo.pl/22726997
Alfaparf Milano Alfaparf Easy Lift 7 Blonde&Brunette Puder Rozjaśniający Do 7 Tonów 50G,"9,50",https://www.ceneo.pl/87826766
Alta puder przeciw poceniu się stóp 40 g,"9,50",https://www.ceneo.pl/31290435
Rimmel London Stay Matte puder 14g 008 Cashmere,"9,50",https://www.ceneo.pl/82871515
Nacomi Puder do Kąpieli Malinowa Babeczka 150g,"9,59",https://www.ceneo.pl/51773899
Nacomi Bublle Puder do kąpieli Greckie lato 150G,"9,59",https://www.ceneo.pl/52520421
Time Out Puder Zwiększający Objętość Instant Volume Powder 10G,"9,59",https://www.ceneo.pl/97111389
Rimmel Stay Matte Pressed Powder Puder prasowany 14g 004 Sandstorm,"9,68",https://www.ceneo.pl/19845624
"Makeup Revolution Pressed Powder Puder prasowany 6,8g Porcelain","9,72",https://www.ceneo.pl/31532167
Revers Hdbeauty Pro Contour Palette Paleta Do Konturowania Twarzy Nr 01 12G,"9,73",https://www.ceneo.pl/90213728
Revers Puder Ryżowy Prasowany Rice Derma Fixer 10G,"9,73",https://www.ceneo.pl/133563390
Hean Puder Do Twarzy Matte All Day Compact Powder 502 Ivory,"9,79",https://www.ceneo.pl/57481962
Rimmel Podklady Korektory Pressed Powder Puder Stay Matte Peach Glow 003,"9,79",https://www.ceneo.pl/18020935
Golden Rose EYEBROW POWDER Puder do brwi vit. E 106,"9,79",https://www.ceneo.pl/35587730
No36 Puder Do Stóp I Obuwia Dezodorujący Z Naturalnymi Składnikami 35G,"9,80",https://www.ceneo.pl/93554682
Hesh Aritha Szampon Naturalny Puder Do Włosów 100g,"9,87",https://www.ceneo.pl/39804822
"MEDIS SUN GLOW BROKAT I GLAM, BROKATOWY PUDER Z EFEKTEM MASY PERŁOWEJ, FIOLETOWY","9,89",https://www.ceneo.pl/143762565
Amilie Mineral Cosmetics Podkład mineralny JOJOBA Sweet Almond 7g,"9,90",https://www.ceneo.pl/88482906
BEAUTIFLY Pędzel rybka Gold,"9,90",https://www.ceneo.pl/62483037
ALTA proszek przeciwpotowy do stóp,"9,93",https://www.ceneo.pl/6072841
Spuma di Sciampagna Włoski talk perfumowany 200ml,"9,95",https://www.ceneo.pl/16750829
"Manhattan Brow Shake Filling Puder Do Brwi Blond 001 2,5g","9,99",https://www.ceneo.pl/119658565
Manhattan Clearface 2in1 Powder & Make Up 2 w 1 Puder + Podkład 78 Rose Beige,"9,99",https://www.ceneo.pl/26169200
"Revers Zestaw Do Konkurowania Twarzy Bronzera, Różu Policzków Oraz Rozświetlacza Pure Mineral Contour 01 - 7,5 G (130166)","9,99",https://www.ceneo.pl/138523790
Inter Vion pędzel do pudru różu konturowania różowe złoto,"9,99",https://www.ceneo.pl/50347176
Isabellenails Puder Proszek Akryl Clear 15ml,"9,99",https://www.ceneo.pl/97650495
REVERS Puder rozświetlający glitter nights nr 04,"9,99",https://www.ceneo.pl/106842952
"Nina Ricci Puder Brązujący Souffle Solaire 3,5g","9,99",https://www.ceneo.pl/41199611
Golden Rose EYEBROW POWDER Puder do brwi vit. E 104,"9,99",https://www.ceneo.pl/35587732
Constance Carroll Puder Kamień Refil 5 Daydream II 12 g,"9,99",https://www.ceneo.pl/53595036
Wibo Sparkling Lady Baked Powder Puder Rozświetlający Do Twarzy I Ciała 22G,"9,99",https://www.ceneo.pl/97014708
BOURJOIS Paris Bourjois Powder Brush Pędzel Do Makijażu,"10,00",https://www.ceneo.pl/106843649
Sleek Base Duo Kit Podkład Z Pudrem 338 Fudge,"10,00",https://www.ceneo.pl/142985301
Diadem Puder prasowany M & S w puderniczce 8,"10,00",https://www.ceneo.pl/31665189
Diadem Puder prasowany M & S w puderniczce 7,"10,00",https://www.ceneo.pl/31665190
KERASTASE GENESIS PUDER DETOKSYKUJĄCY 2G,"10,00",https://www.ceneo.pl/93216890
Bell Monkey Business Banana Powder Puder Upiększająco Rozświetlający 9g,"10,00",https://www.ceneo.pl/143531465
Hesh Tonizująca Maska W Pudrze Do Twarzy Manjishta Powder 50G,"10,00",https://www.ceneo.pl/97455372
Sleek Base Duo Kit Podkład Z Pudrem 351 White Rose,"10,00",https://www.ceneo.pl/142985287
Sleek Base Duo Kit Podkład Z Pudrem 343 Terracotta,"10,00",https://www.ceneo.pl/142985303
CATRICE Multi Colour Puder w kompakcie 010 ROSE BEIGE,"10,00",https://www.ceneo.pl/31218917
Oriflame – Dezodoryzujący Talk Do Stóp Feet Up,"10,00",https://www.ceneo.pl/135712158
CATRICE Balsam do ust w kredce Pure Shine Colour 050,"10,00",https://www.ceneo.pl/31720252
Sleek Base Duo Kit Podkład Z Pudrem 335 Barley,"10,00",https://www.ceneo.pl/142985270
Diadem Puder prasowany M & S w puderniczce 2,"10,00",https://www.ceneo.pl/31665194
Kerastase Genesis Detox Puder Detoksykujący 2g,"10,00",https://www.ceneo.pl/128743181
Revers CARE & MATT Puder prasowany 02 8g,"10,01",https://www.ceneo.pl/97216622
Rimmel London Stay Matte Long Lasting Pressed Powder 14 g Puder 002 Pink Blossom,"10,03",https://www.ceneo.pl/27229251
Golden Rose EYEBROW POWDER Puder do brwi vit. E 107,"10,04",https://www.ceneo.pl/35587729
Revers Puder rozświetlający STROBE & GLOW HIGHLIGHTER 03 Champagne 8g,"10,08",https://www.ceneo.pl/125362284
REVERS Puder rozświetlający strobe 4 harmony,"10,08",https://www.ceneo.pl/106842984
REVERS Puder rozświetlający strobe 08 opal,"10,08",https://www.ceneo.pl/108002989
REVERS Revers puder rozświetlający strobe 1 unicorn,"10,08",https://www.ceneo.pl/108002986
Revers Puder rozświetlający STROBE & GLOW HIGHLIGHTER 06 Emotion 8g,"10,08",https://www.ceneo.pl/125362369
REVERS Revers puder rozświetlający strobe 2 eternal,"10,08",https://www.ceneo.pl/106843629
Essence The Highlighter puder rozjaśniający odcień 03 Luminous Glow 5 g,"10,09",https://www.ceneo.pl/128073801
Joko Puder prasowany Finish Your Make Up nr 13,"10,09",https://www.ceneo.pl/30173232
Killys Rg Pędzel Puder,"10,19",https://www.ceneo.pl/83180522
Hean Puder Do Twarzy Matte All Day Compact Powder 505 Jamaicasun,"10,19",https://www.ceneo.pl/57481965
Hean Puder Do Twarzy Matte All Day Compact Powder 503 Natural,"10,19",https://www.ceneo.pl/57481963
Hean Matte All Day Neutralizator matujący 501 Translucent,"10,19",https://www.ceneo.pl/63289121
HEAN Matte All Day pudry do twarzy 500 Soft Beige,"10,19",https://www.ceneo.pl/97216705
"Makeup Revolution Bake&Blot Puder Prasowany Banana 5,5g","10,23",https://www.ceneo.pl/76846369
Melaleuca Laboratorium Zasypka do Stóp Proftin-G Przeciwgrzybicza Przeciwbakteryjna Melaleuca 120g,"10,27",https://www.ceneo.pl/43540899
Pierre Rene MIYO Antibacterial Powder Antybakteryjny puder do twarzy 10 g,"10,30",https://www.ceneo.pl/30044521
Pędzel do pudru - Makeup Obsession,"10,30",https://www.ceneo.pl/142850991
PASTEL Show Your Purity Puder do twarzy nr 104 9.3g,"10,37",https://www.ceneo.pl/117954450
PASTEL Show Your Purity Puder do twarzy nr 101 9.3g,"10,37",https://www.ceneo.pl/117953641
PASTEL Show Your Purity Puder do twarzy nr 102 9.3g,"10,37",https://www.ceneo.pl/117953649
PASTEL Show Your Purity Puder do twarzy nr 103 9.3g,"10,37",https://www.ceneo.pl/117954423
Life - Pędzel Do Pudru 1Szt,"10,40",https://www.ceneo.pl/136120965
HEAN Egyptian Sunshine PUDER BRĄZUJĄCY,"10,44",https://www.ceneo.pl/35342582
Beauty Marrakech Ałun Zasypka Przeciwbakteryjna W Pudrze 120G,"10,45",https://www.ceneo.pl/81964558
"HEAN Puder ryżowy High Definition bez lusterka 305, 9 g","10,49",https://www.ceneo.pl/31893394
Rimmel Stay Matte Puder matujący 001 TRANSPARENT,"10,49",https://www.ceneo.pl/34926189
Constance Carroll Puder w kamieniu Compact Refill nr 18 Ivory 12g,"10,49",https://www.ceneo.pl/91834793
Constance Carroll Puder w kamieniu Compact Refill nr 24 Misty Beige 12g,"10,49",https://www.ceneo.pl/91834794
CARROLL PUDER 15 WARM BRONzE,"10,49",https://www.ceneo.pl/23895731
CARROLL PUDER 16 DEEP BRONzE,"10,49",https://www.ceneo.pl/23895734
Constance Carroll Puder w Kamieniu Compact Refill 03 Translucent 17ml,"10,49",https://www.ceneo.pl/27218964
Constance Carroll Blush Crush Róż Do Policzków 25 Pink Blush,"10,49",https://www.ceneo.pl/74660305
Constance Carroll Compact Refill puder w kamieniu nr 29 Sahara 12g,"10,49",https://www.ceneo.pl/81417001
Constance Carroll Puder w kamieniu Compact Refill nr 17 Light Translucent 12g,"10,49",https://www.ceneo.pl/91834792
Constance Carroll Puder w Kamieniu Compact Refill 14 Harvest Blige 17ml,"10,49",https://www.ceneo.pl/27218959
Constance Carroll Puder w Kamieniu Compact Refill 06 Rose Beige 17ml,"10,49",https://www.ceneo.pl/27218962
"MUA Pro-Base Matte Satin Pressed Powder puder w kamieniu Soft Beige 6,5g","10,49",https://www.ceneo.pl/50327577
Constance Carroll Puder w kamieniu Compact Refill nr 20 Sable  12g,"10,49",https://www.ceneo.pl/83246566
Constance Carroll Puder w Kamieniu Compact Refill 01 Candlelight 17ml,"10,49",https://www.ceneo.pl/27218965
CONSTANCE CARROLL PUDER 2 TENDER TOUCH 17G,"10,49",https://www.ceneo.pl/9794569
CARROLL PUDER 9 BISCUIT GLOW,"10,49",https://www.ceneo.pl/23895743
Constance Carroll Puder w Kamieniu Compact Refill 12 Sunhaze 17ml,"10,49",https://www.ceneo.pl/27218960
Constance Carroll Puder kamień refil 19 Warm Ivory 12 g,"10,49",https://www.ceneo.pl/53595406
Constance Carroll Compact Refill puder w kamieniu nr 08 Roma 12g,"10,49",https://www.ceneo.pl/81416997
CARROLL PUDER 11 NATURAL GLOW,"10,49",https://www.ceneo.pl/23895723
Hean High Definition Matte Rice Powder Ryżowy puder matujący 304,"10,49",https://www.ceneo.pl/29344113
Constance Carroll C.C. PUDER W KAMIENIU 33 SAFFRON GLOW,"10,49",https://www.ceneo.pl/83413008
MISS SPORTY PERFECT TO LAST 10H PUDER DO TWARZY 040 IVORY 9G,"10,49",https://www.ceneo.pl/123533506
CUCCIO Dip System wanienka do osypywania pudrem,"10,50",https://www.ceneo.pl/135255945
Constance Carroll Puder w kamieniu Compact Refill nr 33 Saffron Glow  12g,"10,53",https://www.ceneo.pl/83246567
wibo HD Fixing Puder fiksujący transparentny 3g,"10,55",https://www.ceneo.pl/94854432
wibo HD Banana Puder bananowy 3g,"10,56",https://www.ceneo.pl/94854431
Nivelazione Skin Therapy Expert Ochronny Talk do Stóp i Obuwia 110g,"10,56",https://www.ceneo.pl/47283799
Balea Balea Puder zwiększający objętość granat 10g,"10,57",https://www.ceneo.pl/106471727
Dlm Ronney Puder Zwiększający Objętość Do Włosów 10 G,"10,59",https://www.ceneo.pl/132277815
Marion Stylizujący puder do włosów 15g,"10,59",https://www.ceneo.pl/117325822
Makeup Revolution Matte Base Powder Pudrowa Baza P6,"10,62",https://www.ceneo.pl/77179130
Como Milano Puder prasowany do twarzy Puder Velvet Matt 27 porcelain 15g,"10,63",https://www.ceneo.pl/72683537
Como Milano Puder prasowany do twarzy Puder Velvet Matt 22 ivory 15g,"10,63",https://www.ceneo.pl/72683539
Como Milano Puder prasowany do twarzy Puder Velvet Matt 26 peach porcelain 15g,"10,63",https://www.ceneo.pl/72683538
Como Milano Puder prasowany do twarzy Puder Velvet Matt 21 natural 15g,"10,63",https://www.ceneo.pl/72683551
Como Milano Puder prasowany do twarzy Puder Velvet Matt 23 peach 15g,"10,63",https://www.ceneo.pl/72683540
Ados Odżywka Diamond Xl Force Diamentowy Utwardzacz Do Paznokci z Pudrem Diamentowym,"10,67",https://www.ceneo.pl/16979577
