name,price,link
MultiVit Complex smak wiśniowy 20 tabl.,"5,00",https://www.ceneo.pl/47700667
Calcium Z Vit C Tabletki Musujące 20 Szt.,"5,06",https://www.ceneo.pl/4883279
Stakko - Puwer Complex Elektrolity Senior 20tabl.,"5,09",https://www.ceneo.pl/130891015
Vitaminum B compositum Hec 50 tabletek,"5,10",https://www.ceneo.pl/14281813
Olimp Chela-Mag B6 Forte Shot Smak Wiśniowy 25ml,"5,10",https://www.ceneo.pl/136053200
Activlab Vita C 1500mg 20 tabl,"5,11",https://www.ceneo.pl/67501155
Alg Pharma Witamina C Max 30Tabl,"5,17",https://www.ceneo.pl/75720067
Stakko - Puwer Complex Multiwitamina 20tabl.,"5,19",https://www.ceneo.pl/130891049
Panawit Witamina C Dla Dzieci Do Ssania 20Tabl,"5,19",https://www.ceneo.pl/93741802
Medicinae Novativ Witamina C 1000 Mg 20tabl. Musujące,"5,20",https://www.ceneo.pl/120978642
"Vitaminum C 1000 OptiMusss, 20 tabletek musujących","5,20",https://www.ceneo.pl/35742890
Kwas foliowy 30 tabl.,"5,22",https://www.ceneo.pl/30925016
Drvita Tymianek i podbiał bez cukru koi gardło 8 tabl,"5,25",https://www.ceneo.pl/117329778
"XeniVIT Witamina C 1000 mg, 20 tabl. musujących","5,25",https://www.ceneo.pl/43848665
Vocal o smaku czarnej porzeczki 24 past. twarde,"5,27",https://www.ceneo.pl/98073101
Noblepharma Cartilage Plus Z Hydrolizatem Kolagenu Witaminą C Płyn 25ml,"5,29",https://www.ceneo.pl/139315362
"Witamina C 200mg, tabletki powlekane, 60 szt.","5,29",https://www.ceneo.pl/33446590
Alg Pharma Medi Pharm witamina C max 15 kaps,"5,30",https://www.ceneo.pl/99080892
Domowa Apteczka Witamina B Complex 50 tabletek,"5,35",https://www.ceneo.pl/17920078
Xenico XeniVIT bio Witamina C 1000 20tabl.,"5,35",https://www.ceneo.pl/101563454
Avetinol D + Czosnek 60 kaps,"5,39",https://www.ceneo.pl/99998228
SWANSON Cynk Glukonian 30mg 30 tab.,"5,40",https://www.ceneo.pl/102160278
OLIMP Gold-Vit C 2000 shot o smaku cytrynowym 25ml,"5,43",https://www.ceneo.pl/69853087
Uniphar Vitamina C 1000L 20 tabl.,"5,45",https://www.ceneo.pl/69786332
Polfa-Łódź WITAMINA B-COMPLEX Tabletki na niedobór witamin z grupy B 50tabl.,"5,45",https://www.ceneo.pl/26136178
PHARMACY LABORATORIES C-1000 Plus 60 kaps.,"5,48",https://www.ceneo.pl/120595471
Olimp gold-vit complex shot amp.x 25 ml,"5,49",https://www.ceneo.pl/90140545
"Stakko Puwer Complex - Biflorin Elektrolity, 20tabl.","5,49",https://www.ceneo.pl/131717189
Dextro Energy Glukoza Dextro Energyminis O Smakumalinowym Z Witaminą C 50G,"5,49",https://www.ceneo.pl/111365578
Salvum Lab Witamina C 1000 20Tabl. Musujące,"5,50",https://www.ceneo.pl/144846301
Vitalite Witamina C Forte 20 tabl.,"5,53",https://www.ceneo.pl/49485671
Herbapol Syrop z jeżówki z witaminą C 100ml,"5,54",https://www.ceneo.pl/48114745
Olimp Chela-Mag B6+D3 Forte Shot smak wiśniowy 25 ml,"5,55",https://www.ceneo.pl/92796381
Witamina C 1000 Forte 20 sasz,"5,56",https://www.ceneo.pl/93238716
Protego Cynk Organiczny 30 tabl,"5,57",https://www.ceneo.pl/97035028
Laboratoria Gemini Sema Lab Witamina B Complex 60Tabl. Powlekanych,"5,59",https://www.ceneo.pl/140487011
Stakko Puwer Complex Biflorin Elektrolity 20tabl. musujących,"5,59",https://www.ceneo.pl/131717126
Doppelherz Aktiv Witamina C + Cynk 15tabl.,"5,59",https://www.ceneo.pl/106022403
Zdrovit Complex Witaminy i Minerały 56 tabletek,"5,59",https://www.ceneo.pl/24799730
Witamina C 1000mg 20 tabletek musujących,"5,63",https://www.ceneo.pl/16540046
Swisspharm Rutivit C Max 120 Tabletek,"5,65",https://www.ceneo.pl/74152798
Junior-angin lizaki na ból gardła o smaku truskawkowym 8 szt.,"5,65",https://www.ceneo.pl/59392786
Starpharma Vitaminum C 1000mg strong 30 kaps,"5,65",https://www.ceneo.pl/90026328
Puwer Complex Multiwitamina 20tabl. musujące,"5,68",https://www.ceneo.pl/141235024
Medi Pharm Rutyna z witaminą C i maliną 120 tabl,"5,69",https://www.ceneo.pl/102680136
Cynk organiczny 30 tabletek,"5,69",https://www.ceneo.pl/26136171
Witamina C 1000mg 20 tabletek musujących dla osób odchudzających się oraz diabetyków,"5,71",https://www.ceneo.pl/26817085
MULTIWITAMINA CEPHAMED 20 tabl musujących,"5,72",https://www.ceneo.pl/92050575
Avetin Cynk + Witamina C 30 tabl,"5,75",https://www.ceneo.pl/96842262
Betteryou Conception Oral Spray 25ml,"5,75",https://www.ceneo.pl/113353704
COLFARM VITAMINUM C 200 - 2 x 30 tabl.,"5,79",https://www.ceneo.pl/92747853
"Stakko - Puwer Complex Multiwitamina, kompleks witamin, 20tabl.","5,79",https://www.ceneo.pl/130891026
Mbm Pharma Witamina B Complex 60tabl.,"5,80",https://www.ceneo.pl/144846320
Witamina C Forte 1000mg 20 tabletek musujących,"5,80",https://www.ceneo.pl/38396046
Herbapol Syrop z czystka z wit. C 100 ml,"5,82",https://www.ceneo.pl/43637986
ADMIRA Witamina C krople doustne 30 ml,"5,83",https://www.ceneo.pl/100403074
CeMax 30 tabl.,"5,85",https://www.ceneo.pl/14692303
Witamina B Complex 60 tabl. drażowych TEVA,"5,86",https://www.ceneo.pl/53230148
Vitaminum B Compositum Forte Hec 60 Tabl.,"5,88",https://www.ceneo.pl/17482733
Colfarm Max Cynk Zdrowe Włosy I Paznokcie 30Tabl,"5,90",https://www.ceneo.pl/86876829
Ascorvita Witamina C 10 tabletek musujących,"5,90",https://www.ceneo.pl/4883300
Allnutrition witamina C 1000mg z bioflawonoidami 30 kaps,"5,90",https://www.ceneo.pl/54276876
Olimp Chela-Mag B6 Forte Shot Pomarańczowy 25ml,"5,95",https://www.ceneo.pl/136053206
Zincas MAX C+D3 x 50 tabl,"5,95",https://www.ceneo.pl/110023124
Oleofarm Witamina C C-Vitum 1000Mg Tabletki Musujące 24szt.,"5,98",https://www.ceneo.pl/110322953
Life Calcium + Kwercetyna 20 tabl. musujących,"5,99",https://www.ceneo.pl/96535213
"Titlis Spółka Z Ograniczoną Odpowiedzialnością ZINIQ Witamina C 1000 mg, 20 tabl","5,99",https://www.ceneo.pl/117002995
"DOZ PRODUCT Calcium + Kwercetyna, tabletki musujące, 20 szt.","5,99",https://www.ceneo.pl/124574142
Ziniq Witamina C 250 Mg 50tabl.,"5,99",https://www.ceneo.pl/138053630
RUTINOWITUM C 150 tabl,"5,99",https://www.ceneo.pl/57845412
"Ziniq Calcium 300 Mg + Kwercetyna, 20tabl. Musujących","5,99",https://www.ceneo.pl/136053178
Witamina C tabletki musujące 20 szt,"5,99",https://www.ceneo.pl/37370756
COLGRIP HOT ACTIV saszetki lek na przeziębienie grypę 8sasz,"5,99",https://www.ceneo.pl/32927766
Swanson Witamina C z dziką różą 500mg 100 kaps.,"5,99",https://www.ceneo.pl/14915429
Avetpure Witamina C proszek 100 g,"5,99",https://www.ceneo.pl/98075240
OstroVit Vitamin C 30 tabs,"5,99",https://www.ceneo.pl/84852100
Herbapol Kraków: syrop z kwiatu bzu z witaminą C - 100 ml,"6,00",https://www.ceneo.pl/25824356
Apteo Mutliwitamina z minerałami o smaku pomarańczowym 20 tabl,"6,00",https://www.ceneo.pl/73528863
"VitaCea krople 0,1g/1ml 30ml","6,03",https://www.ceneo.pl/4773898
Herbapol Syrop z buraka z witaminą C 100ml,"6,04",https://www.ceneo.pl/44627052
xenico Pharma Zestaw xenivit Bio Witamina C 1000 2x30 Kaps,"6,04",https://www.ceneo.pl/104114891
Herbapol Syrop Z Dziewanny Z Wit.C 100 ml,"6,04",https://www.ceneo.pl/4775441
"Syrop z kwiatu mniszka z witaminą C, 100ml","6,05",https://www.ceneo.pl/55196352
Medicinae Novativ Calcium + Kwercetyna Smak Cytrynowy 20tabl. Musujących,"6,15",https://www.ceneo.pl/135445213
OLIMP Gold-Vit C 2000 Shot PureWay-C (Witamina C) 25ml Cytryna,"6,18",https://www.ceneo.pl/92376035
Rodzina Zdrowia Immunosine 10 Sasz O U Malinowym,"6,24",https://www.ceneo.pl/77416573
Farmax Witamina C 1000 Mg Musująca Z Błonnikiem 20 Tabletek Musujących,"6,25",https://www.ceneo.pl/22400613
AMOLOWE NA GARDŁO z miodem i witaminą C 16 pastylek,"6,28",https://www.ceneo.pl/40103760
Calcium Kruger 20 tabletek,"6,29",https://www.ceneo.pl/37839528
APTEO Multiwitamina z żeń-szeniem o smaku cytrynowym - 20 tabl. mus.,"6,31",https://www.ceneo.pl/31903284
Gardipect 16 past.,"6,32",https://www.ceneo.pl/28463617
Salvum Laboratories Protego Elektrolity Lemon&mint Musujace 5X20Tabl.,"6,33",https://www.ceneo.pl/127317992
OstroVit Pharma Vitamin C drops 30 ml,"6,38",https://www.ceneo.pl/102158472
Rutokal C Plus 20 Tabletek Musujacych,"6,40",https://www.ceneo.pl/36246100
Rodzina Zdrowia Witamina C 1000 x 20 tabl musujących,"6,41",https://www.ceneo.pl/53240234
Vitbaby C krople dla niemowląt od 1 miesiąca życia 30ml,"6,42",https://www.ceneo.pl/40752913
Pharmasis Vitaminum C 1000 mg + Cynk 20 tabl musujących,"6,46",https://www.ceneo.pl/101445563
Biocanto Witamina B Complex 60tabl. Powlekanych,"6,48",https://www.ceneo.pl/107243015
Plusssz Odporność Senior 100% Complex 20 tabl,"6,48",https://www.ceneo.pl/98247401
Apteo Czosnek kapsułki bezzapachowe 30 kaps.,"6,49",https://www.ceneo.pl/43737172
Life Witamina B Complex 50 tabl,"6,49",https://www.ceneo.pl/94987221
Mbm Pharma Elektrolity + Witamina C 20 Tabl.,"6,50",https://www.ceneo.pl/120376780
Herbapol Kraków: syrop sosnowy z witaminą C - 100 ml,"6,50",https://www.ceneo.pl/10545767
Oleofarm Vita-C Max 1000 Mg Buzzzujące 24Tabl,"6,50",https://www.ceneo.pl/101198452
C-PUWER Witamina C Forte 1000 mg 30 kaps,"6,51",https://www.ceneo.pl/92837902
Pharmasis Vitaminum C 1000mg + propolis + echinacea smak pomarańczowy 20 tabl. musujących,"6,52",https://www.ceneo.pl/42964087
Teva Mono Witamina C X 50 Tabl,"6,58",https://www.ceneo.pl/81112191
Colfarm Beta Karoten Plus 60 kaps.,"6,59",https://www.ceneo.pl/53088668
Protego Multiwitamina + Cynk 20 tabl. musujących,"6,59",https://www.ceneo.pl/107221176
"Activlab - Vita C 1500mg,  smak pomarańczowy, 20 tabl.","6,60",https://www.ceneo.pl/124301892
Uniphar Cynk Organiczny Forte 15Mg,"6,62",https://www.ceneo.pl/102601443
Novativ Alco Control 15 tabletek,"6,64",https://www.ceneo.pl/137626501
Medicinae Novativ Calcium + Kwercetyna Smak Cytrynowy 20tabl. Musujących,"6,65",https://www.ceneo.pl/135445104
Info Farm Naturplanet Chlorek Magnezu 500g,"6,66",https://www.ceneo.pl/87125119
Body Vitality Complex + D3 30 kaps.,"6,69",https://www.ceneo.pl/93930405
name,price,link
Dermatol Proszek 2 G,"2,09",https://www.ceneo.pl/15038553
Farmina Puder w płynie 100 g,"6,11",https://www.ceneo.pl/2540019
Hasco-Lek Puder płynny wysuszający 100 g,"6,61",https://www.ceneo.pl/30918709
Dermopur Puder W Płynie 60 G Tuba,"6,79",https://www.ceneo.pl/4879124
Propolis 3% Puder 30G,"7,16",https://www.ceneo.pl/14054165
Proftin-G zasypka do stóp 120g,"7,21",https://www.ceneo.pl/4774538
Zasypka antyperspiracyjna 100 g,"7,29",https://www.ceneo.pl/31892538
Dermopur Puder Plynny 60 g,"7,88",https://www.ceneo.pl/28538639
Hasco Puder płynny z anestezyną 100 g,"7,93",https://www.ceneo.pl/8588523
Farmona nivelazione zasypka do stóp i obuwia 110 g,"8,25",https://www.ceneo.pl/53240283
Zasypka ziołowa szałwiowo rumiankowa 100g,"8,76",https://www.ceneo.pl/10690057
Aflofarm Puder płynny z anestezyną 100 g,"9,04",https://www.ceneo.pl/7412684
Antypot puder leczniczy 30 g,"9,50",https://www.ceneo.pl/28086832
Alta Ziol.Sr.P/Poc.Nóg Prosz. 40 G,"9,54",https://www.ceneo.pl/7417527
PIPI NITOLIC Zestaw (saszetka 20 ml + grzebień),"9,79",https://www.ceneo.pl/32092585
Puder propolisowy 3% 30 g. - Farmapia,"10,50",https://www.ceneo.pl/8588592
Pedipur S puder przeciwpotny do stóp i dłoni 60g,"11,50",https://www.ceneo.pl/61491508
"Pedipur puder leczniczy 0,2 g|1g 60 g","11,79",https://www.ceneo.pl/52986150
Mykodermina puder leczniczy 15g,"11,86",https://www.ceneo.pl/4879107
Pudroderm 140g,"11,90",https://www.ceneo.pl/8362114
Puder Propolisowy 7% Preparat na stany zapalne skóry otarcia i oparzenia 30g,"12,35",https://www.ceneo.pl/30924888
BARTPOL Propolis 3% puder 30g,"12,40",https://www.ceneo.pl/10737841
Żyworódka W Zasypce 50 ml,"12,43",https://www.ceneo.pl/25695169
Antypot Zasypka 30 G,"12,99",https://www.ceneo.pl/7417524
Mercator Medical Rękawice Nitrylowe Nitrylex Pf Bez Pudru Niebieskie 100szt. Rozmiar M,"14,99",https://www.ceneo.pl/35545504
Rękawiczki winylowe bez pudru Simple Vinyl PF (M),"15,30",https://www.ceneo.pl/102767555
Brava puder do skóry w stomii 25 g 16 szt,"15,50",https://www.ceneo.pl/101160829
Doman Rękawice winylowe bez pudru,"15,90",https://www.ceneo.pl/49618469
Daktarin Puder leczniczy 20mg/g 20 g,"16,07",https://www.ceneo.pl/4774395
"Puder Rodzinny Do Pielęgnacji Ciala(Pampa), 100 G","16,57",https://www.ceneo.pl/4879108
"Makeup Revolution Lipstick szminka do ust Make Me Tonight 3,8g","0,60",https://www.ceneo.pl/52688753
Delia Cosmetics Velvet Matt Long Wear Be Glamour 3D Lashes trwała szminka z matowym wykończeniem odcień 104 So Cute 5ml,"1,99",https://www.ceneo.pl/96757117
Delia Cosmetics Velvet Matt Long Wear Be Glamour 3D Lashes trwała szminka z matowym wykończeniem odcień 105 Berry Sorbet 5ml,"1,99",https://www.ceneo.pl/96757120
Delia Cosmetics Velvet Matt Long Wear Be Glamour 3D Lashes trwała szminka z matowym wykończeniem odcień 108 Obsession 5ml,"1,99",https://www.ceneo.pl/96757125
Revlon Vital Radiance Szminka Do Ust 046 Classic Wine,"3,99",https://www.ceneo.pl/34825177
W7 Szminka Do Ust Matte Kiss Lipstick Tendertouch,"4,80",https://www.ceneo.pl/57481390
Astor Kiss & Go trwała szminka 212 Sexy,"4,99",https://www.ceneo.pl/90121684
rimmel SZMINKA W PŁYNIE STAY MATTE 810,"5,99",https://www.ceneo.pl/68616404
Virtual Półtransparentna szminka do ust 06-showup,"6,19",https://www.ceneo.pl/90140175
Ingrid Cosmetics Ochronna szminka balsam do ust Beauty Balm Protective Lipstick gumabalonowa,"6,22",https://www.ceneo.pl/102089386
Ingrid Cosmetics Ochronna szminka balsam do ust Beauty Balm Protective Lipstick owoceegzotyczne,"6,27",https://www.ceneo.pl/116440483
Technic Colour Max Matowa Szminka Matte Pink,"6,40",https://www.ceneo.pl/86239315
Maybelline Color Drama szminkaw pisaku 140 Minimalist 2g,"6,59",https://www.ceneo.pl/39052665
"Makeup Revolution Nudes Collection Metallic metaliczna szminka w płynie Corset 2,2g","6,78",https://www.ceneo.pl/79431159
"Makeup Revolution Matte szminka matująca odcień 119 Hustle 3,5 ml","6,97",https://www.ceneo.pl/92512811
Essence Stay 8h Matte długotrwała szminka w płynie odcień 02 Duck Face 3ml,"7,19",https://www.ceneo.pl/91368241
Essence Stay 8h Matte długotrwała szminka w płynie odcień 05 Date Proof 3ml,"7,19",https://www.ceneo.pl/91368243
"Makeup Revolution Matte szminka matująca odcień 121 Head-turner 3,5ml","7,21",https://www.ceneo.pl/92984365
MUA Luxe Matowa Szminka w Płynie Kooky,"7,99",https://www.ceneo.pl/72373391
AVON Mark Szminka  Matte Legend  Flawless,"8,00",https://www.ceneo.pl/98257458
"Essence hydra MATTE matowa szminka nawilżająca odcień 402 Honey-stly 3,5g","8,39",https://www.ceneo.pl/127522183
I Heart Makeup Lip Geek Szminka Totally Not Boring,"8,39",https://www.ceneo.pl/46000669
"Essence hydra MATTE matowa szminka nawilżająca odcień 404 Virtu-rose 3,5g","8,39",https://www.ceneo.pl/127522186
"Essence hydra MATTE matowa szminka nawilżająca odcień 403 Peach It! 3,5g","8,39",https://www.ceneo.pl/127522185
"Essence hydra MATTE matowa szminka nawilżająca odcień 401 Mauve-Ment 3,5g","8,39",https://www.ceneo.pl/127522181
"Essence hydra MATTE matowa szminka nawilżająca odcień 408 Pink Positive 3,5g","8,39",https://www.ceneo.pl/127522195
"Makeup Revolution Lip Vinyl szminka w płynie odcień Glorified 3,6ml","8,41",https://www.ceneo.pl/92114506
"Makeup Revolution Lip Vinyl szminka w płynie odcień Chauffeur 3,6ml","8,41",https://www.ceneo.pl/93598353
"Makeup Revolution Lip Vinyl szminka w płynie odcień Ruby 3,6ml","8,41",https://www.ceneo.pl/91720009
"Makeup Revolution Lip Vinyl szminka w płynie odcień Ballerina 3,6ml","8,41",https://www.ceneo.pl/91720010
Starpharma Puder Rodzinny Do Ciała 100G,"16,75",https://www.ceneo.pl/95470179
"Makeup Revolution Lip Vinyl szminka w płynie odcień Dollhouse 3,6ml","8,41",https://www.ceneo.pl/91720014
"Makeup Revolution Lip Vinyl szminka w płynie odcień Black Forest 3,6ml","8,41",https://www.ceneo.pl/91720008
"Makeup Revolution Lip Vinyl szminka w płynie odcień Icon 3,6ml","8,41",https://www.ceneo.pl/93598352
Maybelline Color Drama szminkaw pisaku 130 Love My Pink 2g,"8,59",https://www.ceneo.pl/39052662
I Heart Makeup Lip Geek Szminka Is This All I Need,"8,68",https://www.ceneo.pl/46000663
Makeup Revolution Matte matowa szminka odcień 121 Head Turner 3ml,"8,78",https://www.ceneo.pl/85848823
Rimmel Lasting Finish Lasting Finish trwała szminka odcień 700 Unclothed 4g,"8,78",https://www.ceneo.pl/100810048
Vipera Rendez Vous szminka do ust długotrwała 80 Ample 4g,"8,80",https://www.ceneo.pl/81119417
"Maybelline Color Drama Szminka W W Pisaku
 210 Keep It Classy Intensive Velvet Lip Pencil 2G","8,99",https://www.ceneo.pl/45736655
Makeup Revolution Silicone Eye Szminka w Płynie Death by Chocolate 12ml,"9,07",https://www.ceneo.pl/51463303
Makeup Revolution Matte matowa szminka 107 RBF 3ml,"9,10",https://www.ceneo.pl/86314122
"Essence Hydrating Nude szminka nawilżająca odcień 301 3,5 g","9,19",https://www.ceneo.pl/113983015
Magnetic Play Zone Hamster Barwa i Blask szminka SK08 Safari Hue 2g,"9,49",https://www.ceneo.pl/81329419
Bebe Young Care Szminka różana 4.9g,"9,49",https://www.ceneo.pl/127181412
Magnetic Play Zone Hamster Barwa i Blask szminka SK02 Coral Gem 2g,"9,49",https://www.ceneo.pl/81329413
Makeup Revolution Matte matowa szminka odcień 101 Piece Of Cake 3ml,"9,63",https://www.ceneo.pl/85848819
Mua Luxe Matowa Szminka W Płynie Flair,"9,75",https://www.ceneo.pl/86239412
Constance Carroll Szminka W Kredce Matte Power Lipstick 10 Red Wine,"9,88",https://www.ceneo.pl/86239551
Constance Carroll Matte Power Lipstick Matowa szminka w kredce 11-fuchsia,"9,88",https://www.ceneo.pl/90140152
Constance Carroll Szminka W Kredce Matte Power Lipstick 12 Magenta,"9,88",https://www.ceneo.pl/86239552
Makeup Revolution Matte matowa szminka odcień 102 Misbehaving 3ml,"9,95",https://www.ceneo.pl/87445129
"Nyx High Voltage Lipstick Szminka do Ust Beam 2,5g","9,99",https://www.ceneo.pl/51031682
"Nyx High Voltage Lipstick Szminka do Ust Hollywood 2,5g","9,99",https://www.ceneo.pl/51031686
"Colyfine Regenerujące Serum do Ust w Szmince 4,1g","9,99",https://www.ceneo.pl/50351985
"Nyx High Voltage Lipstick Szminka do Ust Rags To Riches 2,5g","9,99",https://www.ceneo.pl/51031688
Makeup Revolution Szminka Iconic Pro 32g,"9,99",https://www.ceneo.pl/69868235
Pierre Rene Lips Cashmere szminka No 04 3g,"9,99",https://www.ceneo.pl/80693052
"Nyx High Voltage Lipstick Szminka do Ust Burlesque 2,5g","9,99",https://www.ceneo.pl/51031683
AVON Matowa szminka True Color  Ruby Kiss,"10,00",https://www.ceneo.pl/92122758
Catrice Ultimate Stay Szminka do Ust 090,"10,00",https://www.ceneo.pl/46000770
AVON Matowa szminka True Color  Truest Red,"10,00",https://www.ceneo.pl/92122878
Catrice Ultimate Lip Colour Kryjąca pomadka do ust 360 MATTRACTION,"10,00",https://www.ceneo.pl/34925249
Catrice Ultimate Colour Szminka do Ust 410,"10,00",https://www.ceneo.pl/46000764
"Makeup Revolution Nudes Collection Metallic metaliczna szminka w płynie Lingerie 2,2g","10,03",https://www.ceneo.pl/79431161
"Makeup Revolution Nudes Collection Metallic metaliczna szminka w płynie Pixelated 2,2g","10,03",https://www.ceneo.pl/79431162
Makeup Revolution Matte matowa szminka odcień 122 Darling 3ml,"10,03",https://www.ceneo.pl/87445125
Essence Stay 8h Matte długotrwała szminka w płynie odcień 01 Hello Sunrise 3ml,"10,09",https://www.ceneo.pl/91368240
"Essence Caring Shine Szminka Pielęgnująca Odcień My Love 3,5 G","10,09",https://www.ceneo.pl/140530518
"Essence Electric Glow szminka zmieniająca kolor w zależności od nastroju 3,2g","10,09",https://www.ceneo.pl/127522179
"Essence Caring Shine Szminka Pielęgnująca Odcień 204 My Way 3,5 G","10,09",https://www.ceneo.pl/141649877
"Essence Caring Shine Szminka Pielęgnująca Odcień 201 My Dream 3,5 G","10,09",https://www.ceneo.pl/141649878
"Essence Caring Shine Szminka Pielęgnująca Odcień 202 My Mind 3,5 G","10,09",https://www.ceneo.pl/141649879
Essence Stay 8h Matte długotrwała szminka w płynie odcień 08 Dare You 3ml,"10,09",https://www.ceneo.pl/91368244
Artdeco The Sound of Beauty Perfect Mat szminka z matowym wykończeniem 134.138 Black Currant 4g,"10,13",https://www.ceneo.pl/49612297
"Makeup Revolution Halloween Vinyl Liquid Lip długotrwała szminka w płynie z wysokim połyskiem odcień Scream 2,2g","10,13",https://www.ceneo.pl/87445000
Makeup Revolution Matte matowa szminka odcień 103 Knockout 3ml,"10,19",https://www.ceneo.pl/87445131
"Golden Rose Szminka z Woskiem 133 4,2g","10,34",https://www.ceneo.pl/45843329
Maybelline Szminka Hydra Extreme z Kolagenem Bogaty Kolor i Głębokie Nawilżenie 535 Passion Red 4ml,"10,39",https://www.ceneo.pl/27218797
bourjois Metaliczna szminka do ust Rouge Fabuleux Lipstick 21 chocolat show,"10,39",https://www.ceneo.pl/95351273
Vipera Pomadka Odporny Kolor Mpz Hamster Sk06 Serene Beauty,"10,49",https://www.ceneo.pl/25924616
Vipera Pomadka Utleniająca Mpz Hamster Su03 Tiul,"10,49",https://www.ceneo.pl/26176470
Magnetic Play Zone Hamster Barwa i Blask szminka SK05 Ginger Grace 2g,"10,49",https://www.ceneo.pl/81329416
"Nina Ricci Puder Brązujący Lumiere Solaire 86 3,5 g","1,79",https://www.ceneo.pl/54417311
"Nina Ricci Puder W Kamieniu Hale Beige 117 3,5G","1,79",https://www.ceneo.pl/92170804
Lirene Peel Puff Oczyszczający puder peelingujący Jęczmień + Agawa 7g,"2,99",https://www.ceneo.pl/112980804
Lirene Peel Puff Oczyszczający puder peelingujący Węgiel + Glinka 7g,"2,99",https://www.ceneo.pl/112980803
Antybakteryjny Dezodorant W Pudrze Do Kąpieli Stóp Ałun - Beauté Marrakech Deodorant Alum Powder 25 g,"3,00",https://www.ceneo.pl/85466205
Ronney Professional Puder Do Paznokci Nail Art Powder Glitter 00053,"3,00",https://www.ceneo.pl/102907625
Ronney Professional Puder Do Paznokci Nail Art Powder Glitter 00046,"3,20",https://www.ceneo.pl/102907627
Ronney Professional Puder Do Paznokci Nail Art Powder Glitter 00065,"3,20",https://www.ceneo.pl/102907642
Douglas Collection Powder Puff Puszek do pudru,"3,59",https://www.ceneo.pl/88647884
DONEGAL PUSzEK DO PUDRU biały 9082,"3,80",https://www.ceneo.pl/17048315
Lirene Peel Puff Musujący puder peelingujący Pestki moreli + Witamina C 7g,"3,88",https://www.ceneo.pl/112980802
Balea Relaksująca Sól/Puder Do Kąpieli Magnolia,"3,95",https://www.ceneo.pl/106847525
Puszek Gąbeczka Gąbka do Pudru Bawełniany Puff,"3,99",https://www.ceneo.pl/134635982
Intervion Pędzel Classic Wachlarz,"3,99",https://www.ceneo.pl/97952970
Dax Cosmetics Celia De Luxe Velvet Touch 103 Sandy Beige Puder Prasowany  9 G,"3,99",https://www.ceneo.pl/97518984
Annco Duży Puszek Do Pudru Okrągły Czarny 1Szt,"4,19",https://www.ceneo.pl/77642914
Top Choice Makijaż Puszek do pudru sypkiego 6456,"4,19",https://www.ceneo.pl/10665922
Top Choice Makijaż Puszek do pudru sypkiego 6494,"4,19",https://www.ceneo.pl/10665924
DONEGAL PUSzEK DO PUDRU różowy (9081),"4,20",https://www.ceneo.pl/24610889
Top Choice Fashion Design Puszek do pudru (36804),"4,32",https://www.ceneo.pl/73617737
Top Choice Fashion Design Puszek do pudru 36828,"4,32",https://www.ceneo.pl/73617759
INTER-VION 499086 1szt - puszek do pudru,"4,57",https://www.ceneo.pl/101795096
Azzurra Puder Torebka 100G,"4,96",https://www.ceneo.pl/143759448
Inter Vion Puszek do makijażu 499460,"4,99",https://www.ceneo.pl/25049476
Inter-Vion Inter Vion Puszek Do Pudru Mały,"5,00",https://www.ceneo.pl/38040356
Inter-Vion Puszek do pudru z kokardką,"5,00",https://www.ceneo.pl/59150308
Inter Vion Inter Vion Puszek Do Pudru Z Tasiemka I Obszyc,"5,00",https://www.ceneo.pl/97012145
Top Choice Puszek Do Pudru 6494 Beżowy,"5,31",https://www.ceneo.pl/90026530
Dermalogica Top Choice Puszek Do Pudru Sypkiego,"5,37",https://www.ceneo.pl/135712890
Allwaves Bleaching Powder Rozjaśniacz do technik z wolnej ręki 25 g,"5,39",https://www.ceneo.pl/123528139
Ronney Professional Puder Do Paznokci Nail Art Powder Glitter 00031,"5,40",https://www.ceneo.pl/102907609
Ronney Professional Puder Do Paznokci Nail Art Powder Glitter 00070,"5,40",https://www.ceneo.pl/102907616
Ronney Professional Puder Do Paznokci Nail Art Powder Glitter 00067,"5,40",https://www.ceneo.pl/102907620
Ronney Professional Puder Do Paznokci Nail Art Powder Glitter 00068,"5,40",https://www.ceneo.pl/102907623
Ronney Professional Puder Do Paznokci Nail Art Powder Glitter 00049,"5,40",https://www.ceneo.pl/102907633
Ronney Professional Puder Do Paznokci Nail Art Powder Glitter 00054,"5,40",https://www.ceneo.pl/102907638
Ronney Professional Puder Do Paznokci Nail Art Powder Glitter 00064,"5,40",https://www.ceneo.pl/102907645
Ronney Professional Puder Do Paznokci Nail Art Powder Glitter 00062,"5,40",https://www.ceneo.pl/102907649
Ronney Professional Puder Do Paznokci Nail Art Powder Glitter 00063,"5,40",https://www.ceneo.pl/102907651
Ronney Professional Puder Do Paznokci Nail Art Powder Glitter 00043,"5,40",https://www.ceneo.pl/102907653
Ronney Professional Puder Do Paznokci Nail Art Powder Glitter 00042,"5,40",https://www.ceneo.pl/102907656
Ronney Professional Puder Do Paznokci Nail Art Powder Glitter 00071,"5,40",https://www.ceneo.pl/102907672
Ronney Professional Puder Do Paznokci Nail Art Powder Glitter 00083,"5,40",https://www.ceneo.pl/102907682
Ronney Professional Puder Do Paznokci Nail Art Powder Glitter 00080,"5,40",https://www.ceneo.pl/102907684
Ronney Professional Puder Do Paznokci Nail Art Powder Glitter 00084,"5,40",https://www.ceneo.pl/102907692
Ronney Professional Puder Do Paznokci Nail Art Powder Glitter 00032,"5,40",https://www.ceneo.pl/102907611
Ronney Professional Puder Do Paznokci Nail Art Powder Glitter 00037,"5,40",https://www.ceneo.pl/102907612
Ronney Professional Puder Do Paznokci Nail Art Powder Glitter 00055,"5,40",https://www.ceneo.pl/102907636
Ronney Professional Puder Do Paznokci Nail Art Powder Glitter 00066,"5,40",https://www.ceneo.pl/102907667
Ronney Professional Puder Do Paznokci Nail Art Powder Glitter 00081,"5,40",https://www.ceneo.pl/102907685
Ronney Professional Puder Do Paznokci Nail Art Powder Glitter 00036,"5,40",https://www.ceneo.pl/102907601
Ronney Professional Puder Do Paznokci Nail Art Powder Glitter 0005,"5,40",https://www.ceneo.pl/102907603
