name,price,link
OstroVit Aqua Kick Vitamin C 10 g,"0,90",https://www.ceneo.pl/114725883
Canexpol Group Zmywacz do paznokci Acetonowy z witaminą F 50ml,"1,62",https://www.ceneo.pl/97879568
NOBLE HEALTH Lizak Na Odporność i Gardło Dla Kobiet w Ciąży,"0,90",https://www.ceneo.pl/101445579
Allnutrition witamina C 1000mg z bioflawonoidami 10 kaps,"0,95",https://www.ceneo.pl/59392787
Barcik lizak z propolisem miodem i witaminą C o smaku malinowym 1 sztuka,"0,99",https://www.ceneo.pl/42964101
Activlab Pharma Vitamin C 1000Mg Saszetka 35G,"1,29",https://www.ceneo.pl/94791848
Vitaminum C 200 Lewoskrętna AMS x 25 tabl,"1,29",https://www.ceneo.pl/53240157
Ekspres Apteczny Pharmasis Vitaminum C 1000 Mg + Cynk 15Kaps.,"1,30",https://www.ceneo.pl/143077161
Dr Gaja Promagnez 4G Cytrynian Magnezu 100% Rws Propharma 1 sasz,"1,35",https://www.ceneo.pl/89467561
Zdrowy lizak Mniam-Mniam z witaminą C i D o smaku cytrynowym 1 szt,"1,40",https://www.ceneo.pl/64214940
Zdrowy lizak Mniam-Mniam z witaminą C i D o smaku truskawkowym 1 szt,"1,40",https://www.ceneo.pl/64190768
Stada Pharm Cholinex Lizak Bez Cukru O Smaku Malinowym 1szt.,"1,44",https://www.ceneo.pl/120376741
Zdrowy lizak Mniam-Mniam z witaminą C i D o smaku malinowym 1 szt,"1,45",https://www.ceneo.pl/64214941
Starpharma Zdrowy lizak Mniam-Mniam z witaminą C i D o smaku malinowym 1 szt,"1,49",https://www.ceneo.pl/117325298
Dr Gaja Proodporność 2G Witamina C + Rutyna Propharma 1 sasz,"1,65",https://www.ceneo.pl/89467560
Trumpf Schokoladefabrik Fritt Guma Rozpuszczalna Z Witaminą C 1szt,"1,75",https://www.ceneo.pl/87025025
Cukierki FRITT z witaminą C 1 sztuka,"1,79",https://www.ceneo.pl/28285006
Smile chusteczki nawilżane antybakteryjne z witaminami x 15 szt,"2,38",https://www.ceneo.pl/91931352
AVON Care Krem do rąk z witaminą C wyrównujący koloryt 75ml,"2,50",https://www.ceneo.pl/92197232
Go Wipes Chusteczki Nawilżane Z Witaminami I Ekstraktem Limonki 15 Szt. Antibacterial Effect Vitamins & Lime,"2,68",https://www.ceneo.pl/129573899
Noble Lashes Płatki pod oczy z witaminą C TYPE 2,"2,90",https://www.ceneo.pl/130775108
Bielenda Skin Clinic Professional Proffesional Witamina C Maseczka Rozświetlająco Nawilżająca 8g,"2,99",https://www.ceneo.pl/142059406
"APTEO Maść ochronna z witaminą A, 30g","3,50",https://www.ceneo.pl/127001229
Le Cafe de Beaute Le Cafe Mimi Żel pod prysznic witaminy dla skóry 100ml,"3,59",https://www.ceneo.pl/65516462
Lirene Peel Puff Musujący puder peelingujący Pestki moreli + Witamina C 7g,"3,89",https://www.ceneo.pl/112980802
Apis Maska Algowa Dla Cery Naczynkowej Z Dziką Różą I Witaminą C Professional Couperose-Stop Saszetka 20G,"4,01",https://www.ceneo.pl/93522001
Zyskaj Zdrowie Witamina C 200mg 30 tabl.,"1,88",https://www.ceneo.pl/47039330
Pharmasis Calcium folia 12 tabl.,"1,90",https://www.ceneo.pl/42898477
Noble Health lizak na odporność dla dzieci bez dodatku cukru x 1 szt,"1,90",https://www.ceneo.pl/104307645
Witamina C 200Mg 30tabl.,"1,94",https://www.ceneo.pl/23195285
Zdrovit Calcium  +  Witamina C 20 tabl.,"1,98",https://www.ceneo.pl/4774648
Avet Pharma Witamina C 200 Mg Display 25 Kaps.,"1,99",https://www.ceneo.pl/117728004
SALVUM Witamina C 1000mg 10 kaps,"2,08",https://www.ceneo.pl/93892868
Vitamin C 100 mg  30 tabl. powlekanych,"2,10",https://www.ceneo.pl/35440499
CEWITAN Witamina C 1000 mg 15 kaps.,"2,15",https://www.ceneo.pl/97389978
WITAMINA C 200 mg 25 tabletek powlekanych,"2,21",https://www.ceneo.pl/26870525
Familijny Szampon Do Włosów Czarna Rzepa Z Witaminami 300ml,"4,31",https://www.ceneo.pl/53439503
Soraya Just Glow Opalizująca Maska Peel-Off Z Witaminą C 1 Szt.,"4,50",https://www.ceneo.pl/92842715
Bielenda Skin Clinic Maseczka Witamina C 8g,"4,65",https://www.ceneo.pl/143821881
Ronney Vitamin Complex Professional Mask Revitalizing rewitalizująca maska do włosów z kompleksem witamin 300ml,"4,74",https://www.ceneo.pl/129496423
Le Cafe De Beaute Kafe Krasoty Rewitalizująca Ekspresowa Maska Do Twarzy „Kompleks Witamin” Z Ekstraktem Z Mandarynki 15ml,"4,79",https://www.ceneo.pl/56552668
Avon Clearskin Tonik przeciwtrądzikowy z ekstraktem z pszenicy i witaminą E 100ml,"4,90",https://www.ceneo.pl/85219164
Pharma Group Cynk I Witamina C Do Włosów I Skóry Głowy Handmade 5 ml,"5,69",https://www.ceneo.pl/117646515
Balea Maseczka Na Płacie Z Witaminą C 2-Fazowa 1 Sztuka,"5,72",https://www.ceneo.pl/94828190
Natura Siberica Babuszka Agafia krem do ciała witaminy cytryńca 200ml,"5,77",https://www.ceneo.pl/52422729
Celia Kolagen przeciwzmarszczkowy krem tłusty z witaminami 50ml,"5,79",https://www.ceneo.pl/9055473
Bergamo Koreańska Owocowa Maseczka Z Witaminami 25ml,"5,81",https://www.ceneo.pl/136910314
Beauty Formulas Brightening Vitamin C Rozjaśniająca Maska Do Twarzy Z Witaminą,"5,90",https://www.ceneo.pl/119361480
AvetPharma Witamina C 1000 mg 10 kaps,"2,25",https://www.ceneo.pl/82317637
Vitter Blue Calcium FORTE z Vit. C o smaku pomarańczowym x 20 tabl musujących,"2,30",https://www.ceneo.pl/89020584
CEVIFORTE C 1000 10 kaps.,"2,35",https://www.ceneo.pl/36044487
Calcium  C pomarańcz. APTEO x 20tabl,"2,39",https://www.ceneo.pl/34256961
Lirene Double Bubble Yellow & Violet Maska Glinkowa Do Twarzy Z Witaminą C- 2X5 G,"5,99",https://www.ceneo.pl/92884597
Le Cafe de Beaute Le Cafe Mimi Żel pod prysznic witaminy dla skóry 250ml,"5,99",https://www.ceneo.pl/65516459
Swederm HUD SALVA Vitamin E Silnie natłuszczająca maść do skóry suchej z witaminą E 10ml,"6,00",https://www.ceneo.pl/92587923
Inteligent Skin Theraphy IST Płatki Pod Oczy Aktywna Witamina C 1 para,"6,00",https://www.ceneo.pl/96069533
Cafe Mimi Proteinowa Maska Do Włosów Przeciw Wypadaniu Proteiny Roślinne Ekstrakt Żeń Szenia Kompleks Witamin B3 B5 B6 C E 100Ml,"6,08",https://www.ceneo.pl/70014604
Cafe Mimi Balsam Do Włosów Odżywienie I Objętość Ekstrakt Jagód Acai Olej Macadamii D-Panthenol Witaminy B3 B5 B6 C E 100Ml,"6,10",https://www.ceneo.pl/70014600
Le Cafe De Beaute Cafe Mimi Peeling Do Twarzy Witaminowy Witaminy I Migdał 110Ml,"6,14",https://www.ceneo.pl/77015266
Lili Nawilżane Chusteczki Z Ekstraktem Nagietka I Witaminą E 15 Sztuk Szt.,"6,32",https://www.ceneo.pl/131704419
Calcium  C pomarańcz. APTEO x 20tabl,"2,39",https://www.ceneo.pl/34256961
Owoce Ogrodów Mięta Ziołowe Cukierki Z Miętą I Witaminą C 60 G,"2,40",https://www.ceneo.pl/77416587
Aflofarm Vitaminum C 200 mg tabletki draże (AF) 30szt blistry,"2,49",https://www.ceneo.pl/4880271
"Witamina C 1000+ Bioflawonoidy VivoForte, 10tabl.","2,50",https://www.ceneo.pl/107308456
Noblepharma MUSCLE CLINIC B-COMPLEX płyn 25ml,"2,50",https://www.ceneo.pl/131716895
Polfa Calcium w folii 12 tabl.,"2,58",https://www.ceneo.pl/4775667
Ostrovit Vitamin C 2000 Shot 100ml,"2,59",https://www.ceneo.pl/138053635
Activlab Pharma Vitamin C 2000Mg Shot 100Ml,"2,69",https://www.ceneo.pl/94791847
Witamina C Max 1000 Vitter Blue 10Kaps,"2,71",https://www.ceneo.pl/86410300
Calcium 300 Alergo Wapnowit C 20 tabl.,"2,75",https://www.ceneo.pl/4775745
Colfarm Vitamina C 200mg 30 tabletek,"2,79",https://www.ceneo.pl/15836670
ASCORCIN C 1000 mg 15 kaps,"2,80",https://www.ceneo.pl/83750779
Allnutrition Vit C 2000 80Ml,"2,81",https://www.ceneo.pl/80694509
VITASWISS C 200 FORTE 50 tabl,"2,84",https://www.ceneo.pl/73438565
Dr Vita Vitamina C 100mg blister - 30 tabl.,"2,89",https://www.ceneo.pl/35014512
Vitaminum C 200 30 tabl.,"2,89",https://www.ceneo.pl/50747228
Ostrovit Witamina C 2000 Shot 100 Ml,"2,90",https://www.ceneo.pl/119833755
Magnez + B6 30 Kaps.,"2,95",https://www.ceneo.pl/16753774
Vitaminum B compositum 50 tabl,"2,98",https://www.ceneo.pl/4883266
Protego Calcium Musujące 20 tabl musujących,"2,98",https://www.ceneo.pl/93020437
"WITAMINA C, 100mg, 25 tabl","2,99",https://www.ceneo.pl/114725906
"Zdrovit Witamina C 1000mg, 20 tabl","2,99",https://www.ceneo.pl/93512056
Trec Nutrition Shot Witaminowy Vitamin C 2000 Cytryna Malina 100Ml,"2,99",https://www.ceneo.pl/119833798
Witamina C 200mg 50 tabl.,"2,99",https://www.ceneo.pl/41461663
Premium Rosa Immunity Shot Imbir I Witamina C 150ml,"2,99",https://www.ceneo.pl/112502367
Zdrovit Calcium w folii o sm. cytrynowym 12 tabl. musujących,"2,99",https://www.ceneo.pl/30548425
Protego Witamina C 1000 Go 15 kaps,"3,04",https://www.ceneo.pl/89061893
Aflofarm Witamina C 200mg 30 tabl,"3,04",https://www.ceneo.pl/57927542
Calcium 300 Mg + Witamina C 60Mg Cytynowe 20 Tabletek Musujących,"3,06",https://www.ceneo.pl/112087459
Colfarm Witamina C200 kartonik 30 tabl,"3,09",https://www.ceneo.pl/107531636
Silcare Odżywka Do Włosów Z Jedwabiem I Witaminami Quin Silk & Vitamins Hair Conditioner 250 Ml,"6,35",https://www.ceneo.pl/89821407
"Krem do rąk CZTERY PORY ROKU Witamina, glicerynowy, 130ml","6,45",https://www.ceneo.pl/85285095
"APTEO CARE Pomadka ochronna do ust z witaminami A+E 3,8g","6,49",https://www.ceneo.pl/28034172
Vollare Zmywacz Do Paznokci Pokrzywa Z Witaminą E Cosmetics 60ml,"6,74",https://www.ceneo.pl/99095967
Vollare Zmywacz Do Paznokci Ziołowy Łopian Z Witaminą E Cosmetics 60ml,"6,74",https://www.ceneo.pl/99095965
Vollare Zmywacz Do Paznokci Ziołowy Nagietek Z Witaminą E Cosmetics 60ml,"6,74",https://www.ceneo.pl/99095962
Krem z Witaminami A+e 100ml Naturo Pharma Zdrowa,"6,90",https://www.ceneo.pl/94133650
"Kallos Cosmetics Maska Do Włosów Z Olejem Nasion Konopi, Keratyną I Kompleksem Witamin Hair Pro-Tox Cannabis Mask 275 Ml","6,99",https://www.ceneo.pl/133590726
White Pharma Krem z witaminą C i olejem z rokitnika 100 ml,"6,99",https://www.ceneo.pl/128901610
Vis Plantis Helix Hand Care Krem do Rąk i Paznokci Odżywczy Odmładzający Oliwka Witaminy A B5 E + Poly- Helixan 75ml,"6,99",https://www.ceneo.pl/44069467
Face Facts Scrub Cleansing Peeling Do Twarzy Z Witaminą E 75Ml,"6,99",https://www.ceneo.pl/122634703
Natur Planet Masło Shea nierafinowane pomarańczowe z witaminą E 20ml,"6,99",https://www.ceneo.pl/82247073
"CleanHands, żel antybakteryjny z kolagenem i witaminą E, 50 ml","6,99",https://www.ceneo.pl/98370730
Too Cool For School Rozświetlająca Maseczka ​​W Płachcie Do Twarzy Cytryna Z Witaminą C Natural Vita Mask Brightening 23ml,"7,10",https://www.ceneo.pl/100002729
Too Cool For School Ujędrniająca Maseczka W Płachcie Do Twarzy Jarmuż I Witamina A Natural Vita Mask Firming 23ml,"7,10",https://www.ceneo.pl/100002753
Soraya Just Glow Rozświetlająca Maska Na Tkaninie Z Witaminą C 1 Szt.,"7,19",https://www.ceneo.pl/92842610
Ziaja Liście Zielonej Oliwki Oliwkowa Woda Tonizująca z Witaminą C 200ml,"7,34",https://www.ceneo.pl/32341182
Beauty Formulas Peeling Z Wit C 150ml,"7,37",https://www.ceneo.pl/104115848
Beauty Formulas Chusteczki Do Demakijażu Z Witaminą C Brightening Vitamin Makeup Wipes 30 Szt.,"7,39",https://www.ceneo.pl/139091965
Celia Q10 Witaminy 60+ krem półtłusty przeciw zmarszczkom na dzień i noc 50ml,"7,89",https://www.ceneo.pl/81993548
Dicora Urban Fit Dicora Mydło W Płynie Do Rąk Z Witaminą C O Zapachu Cytrusów I Brzoskwini Urban Fit Nourishing Hand Soap Vit C Citrus & Peach 500 Ml,"7,90",https://www.ceneo.pl/135911792
Life z Witaminą A maść 100g,"7,99",https://www.ceneo.pl/115416755
PHARMA-C-FOOD VENUS Pianka do Golenia Żurawina 200ml,"7,99",https://www.ceneo.pl/16622212
Beauty Formulas Rozjaśniający Krem Do Twarzy Brightening Vitamin C Daily Moisturiser Cream 100Ml,"7,99",https://www.ceneo.pl/103395313
Schwarzkopf Blond Me Detox Detoksykująca Kuracja Z Witaminą C 5X5G,"7,99",https://www.ceneo.pl/87845792
Soraya Just Glow Oczyszczająca Galaretka Do Mycia Twarzy Z Witaminą C 150 Ml,"7,99",https://www.ceneo.pl/92842718
INTELLIGENT SKIN THERAPY WZMACNIAJĄCA I REGENERUJĄCA MASKA Z AKTYWNĄ WITAMINĄ C,"8,29",https://www.ceneo.pl/35552718
Cutex Zmywacz Do Paznokci Z Witaminami Nail Polish Remover Strength Shield 100 ml,"8,40",https://www.ceneo.pl/114489636
Astrid Rozświetlająca Maseczka W Płachcie Do Twarzy ​​Z Witaminą C Vitamin C Energizing And Brightening Textile Mask,"8,57",https://www.ceneo.pl/117467457
Chemia Krem Do Rąk Cztery Pory Roku Witamina Glicerynowy 130ml,"8,74",https://www.ceneo.pl/97036196
"Rodzina Zdrowia, Vitaminum C 1000, 15 kaps","3,10",https://www.ceneo.pl/82830756
Rodzina Zdrowia Calcium z witaminą C 12 tabl.,"3,12",https://www.ceneo.pl/54488926
Diagnosis Vitter Blue Witamina C 200Mg 50 Tabl,"3,15",https://www.ceneo.pl/77425827
Pliva Kraków Calcium smak pomarańczowy 12+2 tabl.,"3,17",https://www.ceneo.pl/43865755
Apteo Calcium z witaminą C smak pomarańczowy 12 tabl.,"3,18",https://www.ceneo.pl/47700673
Witamina C 200mg 50 tabletek,"3,19",https://www.ceneo.pl/14762821
"Diagnosis Witamina C Forte 1000Mg, Vitter Blue, 20 Tabletek","3,24",https://www.ceneo.pl/81614462
Vitaminum B compositum 50 tabletek,"3,24",https://www.ceneo.pl/14596115
Zyskaj Zdrowie Calcium 300mg + Wit C 60mg 20 tabl.,"3,25",https://www.ceneo.pl/50536605
Calcium 300  +  witamina C cytrynowe 20 tabl.,"3,29",https://www.ceneo.pl/17919620
Witamina C 200 Mg X 30 Draż,"3,30",https://www.ceneo.pl/4773905
Zdrovit Witamina C 200 mg 60 tabL,"3,33",https://www.ceneo.pl/45252452
Apteo Care Maść Ochronna z Witaminą A 25g,"3,34",https://www.ceneo.pl/42996773
Zdrovit Calcium cytrynowe 20 tabletek musujących,"3,35",https://www.ceneo.pl/4880969
Calcium 300  +  Vitamina C pomarańczowe 20 tabl.,"3,39",https://www.ceneo.pl/17644647
ALG PHARMA B VitalGold Complex x 60 tabl.,"3,39",https://www.ceneo.pl/91879788
Calcium 300  +  witamina C poziomkowe 20 tabletek musujących,"3,45",https://www.ceneo.pl/27946839
Unipharm Calcium 300 Uni-Phar o smaku pomarań. 20tab,"3,47",https://www.ceneo.pl/90123163
Olimp Chela-Mag B6 Forte Shot 25ml Wiśnia,"3,49",https://www.ceneo.pl/15042511
Vitaminum B Compositum X 50 Draż (Polfa Warszawa),"3,49",https://www.ceneo.pl/4775697
Activlab Pharma Vita C 1000 mg o smaku cytrynowym 20 tabl. mus.,"3,57",https://www.ceneo.pl/98862613
Vitadiet Witamina B Complex 60 Tabl,"3,59",https://www.ceneo.pl/78035107
Rodzina Zdrowia Vitaminum B Complex 60tabl.,"3,61",https://www.ceneo.pl/59150520
ADMIRA Cynk 30 tabl,"3,62",https://www.ceneo.pl/108206966
Zyskaj Zdrowie Witamina B complex 50 tabl.,"3,64",https://www.ceneo.pl/50718871
Goldfarmex Witamina C 1000 mg 20 tabl. mus.,"3,65",https://www.ceneo.pl/44037433
Calcium w folii z witaminą C 12 tabletek musujących,"3,66",https://www.ceneo.pl/4774634
ZYSKAJ ZDROWIE CALCIUM 300mg + KWERCETYNA 20 tabl musujących,"3,66",https://www.ceneo.pl/57432162
Molekin Cynk 15mg 30 tabl,"3,69",https://www.ceneo.pl/97389952
Witamina C 1000mg 10 tabletek musujących,"3,73",https://www.ceneo.pl/4880900
Celia Witamina C odbudowujący krem przeciwzmarszczkowy 75+ 50ml,"8,89",https://www.ceneo.pl/63899205
ANNA COSMETICS Nafta kosmetyczna do włosów z witaminą A+E 120g,"8,93",https://www.ceneo.pl/31093874
Garnier Skin Naturals Mleczna maska na tkaninie rozświetlająca z witaminą C 28 g,"8,99",https://www.ceneo.pl/105402994
Kwiat Życia Krem Do Twarzy Z Witaminą C I Olejem Rokitnika 100Ml,"9,00",https://www.ceneo.pl/139306042
Schaebens Koncentrat Witaminy C 5Szt.,"9,03",https://www.ceneo.pl/120284271
Soraya Just Glow Nawilżający Hydrożel Do Cery Mieszanej I Tłustej Z Witaminą C 50 Ml,"9,09",https://www.ceneo.pl/92842712
EcoLab Japońskie Mleczko do Ciała Witaminy 250ml,"9,15",https://www.ceneo.pl/41219228
Naturplanet Masło Shea Pomarańczowe Z Witaminą E 20Ml,"9,15",https://www.ceneo.pl/89605209
Cussons Pure Nawilżające Mydło Antybakteryjne Do Rąk Rumianek I Witamina E Hand Wash Moisturising Camomile 500ml,"9,29",https://www.ceneo.pl/116327823
ZIOŁOLEK Linourea A+E krem mocznikowy z witaminami A i E 50g,"9,34",https://www.ceneo.pl/37146338
Garnier Skin Naturals Ampułka w masce na tkaninie przeciw oznakom zmęczenia z witaminą C i ekstraktem z ananasa 15g,"9,49",https://www.ceneo.pl/105402991
Blue Pharmaceutical Matka Natura Krem Do Twarzy Witamina C I B5 Kwas Pantetonowy 90Ml Nawilżający Przeciwzmarszczkowy,"9,52",https://www.ceneo.pl/142224109
Cafe Mimi Hipoalergiczny Krem Regenerujący z D-pantenolem Dla Skóry Suchej I Zniszczonej + Witamina E 30ml,"9,53",https://www.ceneo.pl/119836127
Beauty Formulas Serum Z Wit C 30ml,"9,57",https://www.ceneo.pl/104115849
Grace Day Maseczka W Płachcie Do Twarzy Z Witaminą C Traditional Oriental Mask Sheet Vitamin 27Ml,"9,70",https://www.ceneo.pl/116675429
White Pharma Krem Z Witaminą C I Olejem Z Rokitnika Face Cream 100 Ml,"9,79",https://www.ceneo.pl/136408611
Beauty Formulas Rozjaśniający Tonik Do Twarzy Brightening Vitamin C Facial Tonic 150Ml,"9,89",https://www.ceneo.pl/103395312
Brightening Vitamin C Rozjaśniający Peeling Do Twarzy Z Witaminą C 150Ml,"9,98",https://www.ceneo.pl/136093247
Life Skin Treats Witamina C Maseczka Do Twarzy Na Tkaninie,"9,99",https://www.ceneo.pl/117833184
Bione Honey + Q10 regenerująca i ochronna pomadka do ust z witaminą E 17ml,"10,00",https://www.ceneo.pl/49634577
Garnier Vitamin C Żel oczyszczający z witaminą Cg i cytrusem 200 ml,"10,00",https://www.ceneo.pl/131927732
Vipera Nail Polish Remover Fast&Convenient acetonowy zmywacz do paznokci z kompleksem witamin i gliceryną 175ml,"10,09",https://www.ceneo.pl/81417023
Silcare Quin Balsam do ciała Mocznik i witamina E 275ml,"10,11",https://www.ceneo.pl/62925603
Natur Planet Masło Shea nierafinowane pomarańczowe z witaminą E 100ml,"10,15",https://www.ceneo.pl/82247075
Barwa Mydło W Płynie Do Rąk I Ciała Z Witaminą E Natural Extra Care 500ml,"10,19",https://www.ceneo.pl/116328021
Ziaja tonik kwasowy 1% z witaminą C.B3,"10,46",https://www.ceneo.pl/143820060
Soraya Just Glow Rozświetlająca Maska Na Tkaninie Z Efektem Witaminą C,"10,49",https://www.ceneo.pl/119547444
Soraya Just Glow – Krem Nawilżający Do Cery Normalnej Z Witaminą C (50 Ml),"10,49",https://www.ceneo.pl/92839727
"Vitter Blue, Multiwitamina +Minerały, 20 tabl","3,75",https://www.ceneo.pl/84297203
Dextro Energy Glukoza Dextro Lemon Z Witaminą C 46G 8 Kostek,"3,75",https://www.ceneo.pl/39562642
Calcium 300 czyste hypoalergiczne 20 tabletek musujących,"3,77",https://www.ceneo.pl/24885031
Vitaminum B Complex Cephamed tabl. X60,"3,78",https://www.ceneo.pl/83471064
Calcium Dr.Max 20 tabl musujących,"3,83",https://www.ceneo.pl/98075760
Rodzina Zdrowia Vitaminum C Optima 200mg 60 tabl,"3,88",https://www.ceneo.pl/59392791
COLFARM MAX VITA B COMPLEX 60 tabl,"3,88",https://www.ceneo.pl/95059606
Zyskaj Zdrowie Calcium + Witamina C 20 Tabl. Mus.,"3,89",https://www.ceneo.pl/39361928
Global Pharma Cm Medi Pharm Porost Islandzki z witaminą C bez cukru 16 past,"3,89",https://www.ceneo.pl/116223394
Bodymax Tarcza Ochronna x 20 tabl musujących,"3,89",https://www.ceneo.pl/106822718
Swanson Triple Magnesium complex 30 kaps.,"3,90",https://www.ceneo.pl/48778866
Witamilki witamina D3 10ml,"3,90",https://www.ceneo.pl/28216591
ALG PHARMA WITAMINA C 1000 mg 20 tabl musujących,"3,90",https://www.ceneo.pl/92920968
Sanopharm Tymianek + Podbiał Z Witaminą C 12 past.,"3,92",https://www.ceneo.pl/96836375
Witamina C 200mg 50 tabletek,"3,94",https://www.ceneo.pl/14281815
Synoptis Pharma Witamina C Forte Apteo Kapsułki Twarde 15Kaps.,"3,94",https://www.ceneo.pl/92889805
Rutinacea Complete 30 Szt,"3,99",https://www.ceneo.pl/99493217
Allnutrition Witamina C 2000 Shock Shot 80 ml,"3,99",https://www.ceneo.pl/106034470
Dr.Max Witamina C 250mg 50 tabl,"3,99",https://www.ceneo.pl/78442929
Gelviu DZIKA RÓŻA owoc dzikiej róży 50g Witamina C,"3,99",https://www.ceneo.pl/131798652
Galenlab Calcium 300Mg 20Tbl Musujących,"3,99",https://www.ceneo.pl/141561427
Pharmasis Calcium z Wit. C Forte 20tabl.,"3,99",https://www.ceneo.pl/43413778
Active Muss Elektrolity smak cytrynowy 24 tabl,"4,01",https://www.ceneo.pl/64399540
Vitter Blue Witamina C + Cynk x 20 tabl musujących,"4,06",https://www.ceneo.pl/107531039
Zyskaj Zdrowie Witamina C 1000mg 20 tabl.,"4,06",https://www.ceneo.pl/50978710
Cephamed Polska Calcium C pomarańczowe 20 tabl musujących,"4,10",https://www.ceneo.pl/116223425
APTEO Witamina C 1000 mg 15 kaps,"4,10",https://www.ceneo.pl/97389889
Zajatek witamina B2  +  C  +  E 30 tabletek,"4,13",https://www.ceneo.pl/27636263
Cewitan witamina C 1000mg 10 + 5 tabletek musujących,"4,14",https://www.ceneo.pl/14644789
MEDICINAE NOVATIV Calcium 20 tabl. musujących,"4,15",https://www.ceneo.pl/121141295
4F Fuel Shot Z Witaminą C Cytryna-Limonka 25ml,"4,15",https://www.ceneo.pl/144348896
Ams Pharma Calcium+Vitaminum C Optimusss 20tabl,"4,15",https://www.ceneo.pl/86894545
Panawit Calcium z witaminą C smak pomarańczowy 20 tabl,"4,16",https://www.ceneo.pl/60804930
"Laboratoria Gemini Semalab, Witamina C 1000Mg, 10 Kapsułek","4,19",https://www.ceneo.pl/81614471
Olimp Chela-mag B6 Skurcz Shot Pomarańcz Sport 25 Ml,"4,19",https://www.ceneo.pl/102908115
VITASWISS B COMPLEX 60 tabl,"4,20",https://www.ceneo.pl/73438564
Activlab Pharma Vita C 1000 mg o smaku pomarańczowym 20 tabl. mus.,"4,27",https://www.ceneo.pl/98862615
Colfarm Multiwitamina 30 tabletek,"4,28",https://www.ceneo.pl/23964400
GymBeam Magnesium Shot 60 ml cytrynowy,"4,29",https://www.ceneo.pl/95780853
Starpharma Vitaminum C + Wapń Strong 30kaps,"4,39",https://www.ceneo.pl/86463746
Novascon Ceviforte C1500 x 20 tabl.musujacych,"4,40",https://www.ceneo.pl/59802275
Oleofarm Sp. Z O.O. C-Vitum witamina C 1000 mg plus cynk 20tabl,"4,40",https://www.ceneo.pl/117003055
Vitaminum B Complex Forte 50 tabl.,"4,40",https://www.ceneo.pl/42964108
Oleofarm D-Rutin CC 60kaps.,"4,45",https://www.ceneo.pl/128159620
Drvita Med Witamina C 200tabl.,"4,49",https://www.ceneo.pl/113353980
Laboratoria Gemini Semalab Witamina C 200Mg 50 Tabletek Powlekanych,"4,49",https://www.ceneo.pl/82682578
Noblepharma MUSCLE CLINIC D3 + K2 płyn 25ml,"4,49",https://www.ceneo.pl/131716897
Elkos Vivede Vitamin C Tabletki 17szt 102g,"4,50",https://www.ceneo.pl/105096939
Elkos Vivede Calcium Tabletki 17szt,"4,50",https://www.ceneo.pl/107585774
Medicinae Novativ Calcium + Witamina C 20tabl.,"4,50",https://www.ceneo.pl/120376912
Revitaben Witamina C 1000mg 20tabl.,"4,50",https://www.ceneo.pl/26272544
Vitamina C 200 Mg 60 Tabl. (Aflofarm),"4,54",https://www.ceneo.pl/7410727
Mono Witamina C 200mg 50 tabletek,"4,54",https://www.ceneo.pl/71502533
Alg Pharma Witamina C 30 caps,"4,58",https://www.ceneo.pl/92796383
Formeds F-Vit K2 Witamina K2 Mk-7 + Korzeń Cykorii Zdrowe Kości I Naczynia Krwionośne Suplement Diety W Formie Proszku/ 30,"4,59",https://www.ceneo.pl/39092555
Colfarm Max Vita C 1000 10 kaps,"4,60",https://www.ceneo.pl/96573890
Teva Mono Witamina C 50Tabl.,"4,61",https://www.ceneo.pl/143077180
Mbm Pharma Calcium Alergo Complex - Wapń + Kwercytyna 20 Tabl.,"4,61",https://www.ceneo.pl/120376764
CALCIUM + WITAMINA C FORTE BIOTTER Tabletki musujące na niedobór wapnia 20tabl.,"4,69",https://www.ceneo.pl/7410769
Puregood Cukierki Multiwitamina Ze Stewią 50g,"4,69",https://www.ceneo.pl/140487046
Mega Witamina B-Complete 50 tabl.,"4,69",https://www.ceneo.pl/28420168
Witamina C 1000mg 20 tabletek musujących,"4,73",https://www.ceneo.pl/15285009
Stakko Puwer Complex Calcium pomarańczowe 20tabl. musujących,"4,74",https://www.ceneo.pl/131717124
Dextro Energy Glukoza Dextro O Smaku Żurawinowym Z Witaminą C 46G 8 Kostek,"4,74",https://www.ceneo.pl/39562644
Protego Elektrolity Lemon&mint+ 20 tabletek musujących,"4,75",https://www.ceneo.pl/81956955
Chela-Mag B6 Skurcz Smak Grejpfrutowy Płyn 25Ml,"4,79",https://www.ceneo.pl/83471030
Dr Vita Vitamax Calcium + Rutyna 15 Tabl,"4,79",https://www.ceneo.pl/119833670
Syrop Prawoślazowy Z Witaminą C100 ml,"4,79",https://www.ceneo.pl/4881078
Protego witamina C 1000 20 tabl musujących,"4,83",https://www.ceneo.pl/89061896
Novativ calcium + witamina C smak pomarańczowo-brzoskwiniowy 20 tabl. musujących,"4,84",https://www.ceneo.pl/132530378
WELLMEDICA ANGINMED POROST ISL. CZAR.PORZ.B/C 24PAST,"4,89",https://www.ceneo.pl/133560015
"Stakko - Puwer Complex Witamina C 1000 FORTE, 20tabl.","4,89",https://www.ceneo.pl/130891027
Vitaminum C 1000mg Polfa Łódź 20 tabletek musujacych,"4,89",https://www.ceneo.pl/14510902
Olimp Chela-Mag B6 Skurcz Shot 25ml,"4,90",https://www.ceneo.pl/89822094
VITAMINA C 500 mg SYNTEzA 10 kapsułek,"4,90",https://www.ceneo.pl/26715796
Olimp Labs Chela-Mag B6 Forte Shot Ampułka Smak Pomarańczowy 25Ml,"4,90",https://www.ceneo.pl/119833790
Protego Elektrolity Orange 20 Tabletek Musujących,"4,93",https://www.ceneo.pl/81897100
DrVita Witamina C 500 + Cynk 15 tabl,"4,94",https://www.ceneo.pl/120109507
Oleofarm C-Vitum Witamina C 1000mg 30kaps.,"4,95",https://www.ceneo.pl/96743387
Aura Herbals Cynk organiczny 15mg + witamina C 36 pastylek do ssania,"4,95",https://www.ceneo.pl/95769539
2 KC 6 tabl,"4,97",https://www.ceneo.pl/5066399
Cewitan Odporność 30Kaps,"4,98",https://www.ceneo.pl/101197608
GalenLab syrop prawoślazowy z witaminą C 100ml,"4,99",https://www.ceneo.pl/92561151
Superpharm Life Calcium C Pomarańczowe 20 Tabl musujące,"4,99",https://www.ceneo.pl/135565350
"DOZ PRODUCT Calcium Bezsmakowe, tabletki musujące, 20 szt.","4,99",https://www.ceneo.pl/124711241
Dr.Max Witamina B Complex 50 tabl.,"4,99",https://www.ceneo.pl/114286525
Life Witamina C 30tabl,"4,99",https://www.ceneo.pl/92193673
DOZ Calcium + Witamina C smaku pomarańczowym 16 tabl.,"4,99",https://www.ceneo.pl/45287342
DOZ Product Witamina B Complex 60 tabl.,"4,99",https://www.ceneo.pl/44403412
Dextro Energy żurawina z witaminą C glukoza 8 past,"4,99",https://www.ceneo.pl/101232854
Avet Witamina B Complex tabletki powlekane 50 tabl./1opak.,"4,99",https://www.ceneo.pl/129907576
Dextro Energy Glukoza Borówka Z Witaminą C 46G 8 Pastylek,"4,99",https://www.ceneo.pl/111365577
Colfarm Tran Plus 30Kaps,"4,99",https://www.ceneo.pl/97521146
Rodzina Zdrowia Calcium+ Kwercetyna 20 tabletek musujących,"4,99",https://www.ceneo.pl/51167725
"Titlis Spółka Z Ograniczoną Odpowiedzialnością ZINIQ Calcium 500 mg + Witamina C, 20 tabl","4,99",https://www.ceneo.pl/116493710
